question_order,question_answer_group_id,speaker,role,company,content,year,quarter
0,9,Steven Chubak,Analyst,Wolfe Research LLC,"Hi. Good morning. So, wanted to start off with a question on the outlook for Trading and the Investment Banking businesses. J ust, Jeremy,
given the strong pipelines you cited, was hoping you can provide some additional color just in terms of what you're hearing from corporate
clients, especially in the context of the mild recession scenario you outlined, when you would expect to see some inflection in Invest ment
Banking activity. And similar question on the Trading side – you're facing difficult comps in the coming year, we still have QT, rate volatility
proxy is still elevated. Do you anticipate a significant moderation in Trading activity or not?",2022,4
1,9,Jeremy Barnum,Chief Financial Officer,JPMorgan Chase & Co.,"Sure. Thanks, Steve. So, let's do Banking first. So, I think the thing that's interesting about banking  right now is that the declines have been so
significant, obviously from very elevated levels, but even relative to just 2019, 2022 was a relatively weak year. And as we look into 2023, it's
possible that the actual economic environment will be worse than it was in 2022. So, that could conceivably make you pessimistic about the
Investment Banking wallet outlook. And to be sure, it's not as if we're super optimistic.
But it's important to note that part of the issue here is how quickly things changed in 202 2, specifically with respect to rates, as that affects the
debt business and valuations as it affects M&A and ECM as well. And one of the sort of necessary conditions for people to do deals or decide
to raise capital is just getting comfortable with valuat ions in the open market. So, I think there's a chance that that actually winds up helping in
2023 in the Investment Banking wallet. Of course, we don't know, but those are some of the things that we're thinking about.
Jeremy Barnum
Chief Financial Officer , JPMorgan Chase & Co.  A
Similarly, on the Markets side, obviously Markets had another very strong year, better than we'd expected. Since the numbers were so strong
coming out of the pandemic, we were expecting more normalization than what we actually saw . And 2022 had a lot of themes. I think the
active management community did well. That always helps us a little bit. And we had volatility with relatively orderly and continued Markets .
As we look towards 2023, maybe some of those themes will be a little bit less obvious and that could be a little bit of a headwind. But on the
other hand, it's not like the volatility is going away, and Markets seem to continue to be quite orderly. And a 4.5%, 5% rate  environment is
probably one where there's more tr ading opportunities than a 0% rate environment.
So, of course, we don't know. We'll see. I think you would have to probably expect some normalization there. The numbers are really very
strong in Markets. But we'll see. We'll see what happens.",2022,4
2,9,Steven Chubak,Analyst,Wolfe Research LLC,"That's really helpful color. And just for my follow -up on finalization of Basel III, sorry Jeremy, I couldn't help myself here. But in Barr's
December speech, he strongly hinted at capital requirements moving higher for you and peers. You a lso alluded in your comments, or in a
response to one of the questions, that the finalization of Basel III can potentially be very punitive.
Given the absence of the proposal, I was really just hoping you could speak to how you're scenario planning for th e eventual finalization and
any additional detail you can offer on the areas of mitigation. I think the one issue or area of confusion is that one of the  biggest sources of
RWA inflation is op risk, which can't really be mitigated. So, what are the actions  that you can take to really offset some of those potential
headwinds?",2022,4
3,9,Jeremy Barnum,Chief Financial Officer,JPMorgan Chase & Co.,"Yeah. So, Steve, I'd love to get into a whole lot of detail here. But I just think that the question of how to mitigate is re ally hard to discuss in a
lot of detail until we see an actual proposal. And the reason that we talk about potentially punitive increases of you studyi ng this issue closely
is, just to point out, that under the version of the world where you get the worst outcome in al l of the different moving parts of this thing – it’s a
very significant increase to the capital requirements of the system as a whole. And given how strong the system is today, tha t just like doesn't
make sense to us. So, we just want to say that. But yeah , Jamie, please.",2022,4
4,9,Jamie Dimon,"Chairman, Chief Executive Officer",JPMorgan Chase & Co.,"I mean just, look, you guys know the operating risk , capital , the trading book, the CCAR, G -SIFI, all those moving parts. Let's just see what
they are. We'll deal with them when we get there, and then we'll figure  out what we have to modify our business and stuff like that. We don't
think it's necessary to increase capital ratios. We're quite clear on that.
One of the new numbers we put on the top of the press release was our Total Loss Absorbing Capacity. So, we have now almost $500 billion.
I mean, really, like at one point, when is $500 billion of that, of $1 trillion liquidity, are all those things enough? But l et's just see what it is.
They're going to work it through. There are international laws, there are i nternational requirements. We're hoping that America is the same as
international. That would be nice. G -SIFI is supposed to be corrected. We'll see if that happens. So, let's just see. We don't have to guess. And
if the number's too high, we're going to t ell you what we're going to do about it.",2022,4
5,9,Steven Chubak,Analyst,Wolfe Research LLC,Fair enough.,2022,4
6,9,Jeremy Barnum,Chief Financial  Officer,JPMorgan Chase & Co.,"Steve, just a very minor expansion of that, just to expand a bit on Jamie's point , it's important to be clear, there will be time to adjust. Like
there's a long road from the NPR – that sort of supports Jamie's point. Let's see what it is and then we'll...",2022,4
7,9,Steven Chubak,Analyst,Wolfe Research LLC,Fair enough.  Thanks so much for taking my questions.,2022,4
0,10,Matt O'Connor,Analyst,Inc.,"Good morning. How are you guys thinking about managing the securities book given the outlook of lower deposits? Obviously, th e yield curve
is quite inverted depending on what part you're looking at or most parts, frankly. And then at the same time, the securities boo k is cash flowing
a lot less than it was a couple years ago, just given the rate environment.",2022,4
1,10,Jamie Dimon,"Chairman, Chief Executive Officer",JPMorgan Chase & Co.,"Yes. Remember, the securities book is an outcome of investing in basically excess deposits. And you have like $2.4 trillion d eposits and $1
trillion of loans and things like that. And we manage it to manage interest rate exposure, all these various things.
And then when you say the size of it, we forecast – which I'm not going to give you the numbers – we forecast every quarter what we're going
to buy, what we're going to sell, how much is coming in, how much we need for liquidity, and we ad just it all the time based upon deposits
coming down and loans and stuff like that. Obviously, what you get to invest in is at much higher rates today. And you see JP Morgan's loss in
the HTM loan book as a percent is much lower than most other people. We'r e kind of conservative there, too.",2022,4
2,10,Matt O'Connor,Analyst,Inc.,"I guess a bigger picture question – we've seen such a drop in really 5, 10 -year part of the curve and even further out. And banks aren't really
buying; instead they're selling. And I guess I wa s wondering if you had thoughts on who's buying and what's driving the rates so much lower
than most people think they should be at.",2022,4
3,10,Jamie Dimon,"Chairman, Chief Executive Officer",JPMorgan Chase & Co.,"Yeah, we do. But you should read – get the analyst reports to get that. We look at what everybody's doing: pension plans, governments. We
look at every part of the curve. We look what other banks are doing. I thin k I already mentioned earlier in this call, banks are in different
positions. Some may have to sell securities to pay off their loan books. We obviously don't. So, people are in a different po sition.
And as Jeremy pointed out, it's very important, that yi eld curve will not be the same six months from now as it is today. While we use that to
kind of look forward, it's not actually our forecast. We know it will be wrong. But the investment portfolio will be invested  when there are
opportunities. We bought a lot of Ginnie Maes when there was a 60 OAS spread.  We sold – one of the reasons we take securities losses is
because that gives you 10 -plus billion dollars you can reinvest at what you think are more attractive securities.",2022,4
4,10,Matt O'Connor,Analyst,Inc.,Got it. Thank you.,2022,4
0,11,Andrew Lim,Analyst,Société Générale,"Hi. Good morning. Thanks for taking my questions. So, the first one on credit quality, thanks for giving us commentary on the  shape of NCOs,
I guess, specifically for credit cards topping out at the end of this year. Could you give us a bit more color on how reserve b uilds should shape
out this year, I guess, with respect to CECL? I'm guessing they should top out quite soon. That's my first quest ion.",2022,4
1,11,Jeremy Barnum,Chief Fina ncial Officer,JPMorgan Chase & Co.,Okay. Sure.,2022,4
2,11,Andrew Lim,Analyst,Société Générale,This is assuming all your macro assumptions are unchanged and so forth.,2022,4
3,11,Jeremy Barnum,Chief Financial  Officer,JPMorgan Chase & Co.,"Yeah. Andrew, well, I think we've talked about CECL quite a bit. And I think there's some decent color there in terms of Jami e's $6 billion over
a few quarters in a world where the economic outlook is worse than it is today. We're definitely not going to get into the business of giving you
an outlook for a sequential evolution of the loan loss allowance. It's appropriate today, and it will evolve as a function of  the environment.",2022,4
4,11,Andrew Lim,Analyst,Société Générale,"Sure. Okay. Let's drill down into NII then. I just want to square a few comments you made there, Jeremy. So, if I heard you correctly, I think
you are sort of talking about sequential increases in NII, so I guess looking towards like $20 billion plus for 1Q, maybe eve n 2Q. So, I guess
we're hitting about $40 billion for 1H and then a sharp drop -off as, say, deposit costs increase and maybe we get a few Fed Fund rate cuts as
well. Is that the way we should be thinking about it?",2022,4
5,11,Jeremy Barnum,Chief Financial  Officer,JPMorgan Chase & Co.,"Yeah, no. So, let me uncontroversially say no there, Andrew, just for the avoidance of doubt. So, look, my comments about seq uential
increases were to address the sort of obvious conclusion, which you are somewhat correctl y drawing from the slide, which is that, in a world
where we're exiting the fourth quarter run rate at $81 billion, or $80 billion ex Markets or whatever, and we're telling you $74 billion for the full
year, there are obviously some sequential declines in there somewhere as a function of what plays out. We're simply saying don't project
those into the future in perpetuity. Once things adjust, we will return to normal sequential growth. Does that make sense?",2022,4
6,11,Andrew Lim,Analyst,Société Générale,"Right. Got you. Yeah. No, no, no, sure. Absolutely. That makes sense. That's great. Thanks for that.",2022,4
7,11,Jeremy Barnum,Chief Financial Officer,JPMorgan Chase & Co.,Yes. Thanks.,2022,4
0,12,Jeremy Barnum,Chief Financial Officer,JPMorgan Chase & Co.,That's it. Thank you very much.,2022,4
1,12,Jamie Dimon,"Chairman, Chief Executive Officer",JPMorgan Chase & Co.,"Well, thank you very much. We'll talk to you all soon.",2022,4
0,1,Steven Chubak,Analyst,Wolfe Research LLC,"Hey, good morning.",2023,1
1,1,Jeremy Barnum,Chief Financial Officer,JPMorgan Chase & Co.,"Good morning, Steve.",2023,1
2,1,Steven Chubak,Analyst,Wolfe Research LLC,"So, Jamie, I was actually hoping to get your perspective on how you see the recent developments with SVB impacting the regulatory
landscape for the big banks. In your letter you spent a fair amount of time highlighting the consequences of overly stringent  capital
requirements, the risk of steering more activities to the less regulated nonbanks. But what are some of the changes that you're scenario
planning for – whether it's higher capital, increase in FDIC assessment fees? And along those same lines, how you're thinking about the
buyback given continued strong capital build, but a lot of macro uncertainty at the moment.",2023,1
3,1,Jamie Dimon,"Chairman, Chief Executive Officer",JPMorgan Chase & Co.,"Well, I think you were already kind of complete with answering your own question there. Loo k, we're hoping that everyone just takes a deep
breath and looks at what happened and the breadth and depth of regulations already in place. Obviously, when something happen s like this,
you should adjust, think about it. So I think down the road there may be some limitations on held -to-maturity, maybe more TLAC for certain
type-size banks, and more scrutiny on interest rate exposure, and stuff like that. But it doesn't have to be a revamp of the whole  system, just
recalibrating things the right way.
And I think it should be done knowing what you want the outcome to be. The outcome you should want is very strong community and reg ional
banks. And certain actions are taken which are drastic – it could actually make them weaker. So, that's all it is. We do expe ct higher capital
from Basel IV, effectively and, obviously there's going to be an FDIC assessment – that'll be what it is.",2023,1
4,1,Steven Chubak,Analyst,Wolfe Research LLC,"Got it. And just in terms of appetite for the buyback, just given some of the...",2023,1
5,1,Jamie Dimon,"Chairman, Chief Executive Officer",JPMorgan Chase & Co.,"Oh, yeah.",2023,1
6,1,Steven Chubak,Analyst,Wolfe Research LLC,...elevated macro uncertainties.,2023,1
7,1,Jamie Dimon,"Chairman, Chief Executive Officer",JPMorgan Chase & Co.,"Well, we've told you that we're kind of penciling in $12 billion for this year. Obviously, capital is more than that, but – and we did a little bit of
buyback this quarter. We're going to wait and see. We don't mind keeping our powder dry, and you've seen us do that with investment
portfolios, and we're also going to do that with capital.",2023,1
8,1,Steven Chubak,Analyst,Wolfe Research LLC,That's great. I'll hop back into the queue. Thanks so much for taking my questions.,2023,1
9,1,Jamie Dimon,"Chairman, Chief Executive Officer",JPMorgan Chase & Co.,Okay.,2023,1
0,2,Ken Usdin,Analyst,Jefferies LLC,"Hey, thanks. Good morning. Hey, Jeremy, I was just wondering if you can just give us a little bit more detail on those lower funding expectation
points that you made, just in terms of is it because of what you can offer the client that might allow you to kind of keep th at beta lower? And
maybe you can just  kind of wrap it into what your overall beta expectations are in that revised update? Thank you.",2023,1
1,2,Jeremy Barnum,Chief Financial Officer,JPMorgan Chase & Co.,"Yeah, sure. So let me just summarize the drivers of the change in the outlook. So the primary driver really is lower deposit rate paid
expectations across both consumer and wholesale, which, as you mentioned, is driven by a couple factors. So, the change in th e rate
environment, with cuts coming sooner in the outlook, all else equal, does t ake some pressure off the reprice. And as you said, we're getting a
lot of positive feedback from the field on our product offerings. The short -term CD, in particular, is really getting a lot of positive feedback from
our folks in the branches. It's been v ery attractive to yield -seeking customers. So that's kind of working well. And then on the asset side, we
are seeing a little bit higher Card revolve, which is helping.
And I'll just remind you that at a conference in February, I suggested that we were al ready starting to feel like some of the uncertainties we
mentioned when giving the guidance had started all moving in the same direction, and that was one of the things that contribu ted to the
upward revision, like all of the uncertainty kind of went the s ame way. But as Jamie's pointed out – those uncertainties are all still there, we
highlight them on the page, and as we look forward to this year and to next year and the medium -term we remain very focused on those.",2023,1
2,2,Ken Usdin,Analyst,Jefferies LLC,"Yeah, and as a follow -up on the point about rate expectations coming now in, and potentially getting cut sooner – how do you take a look at
what that might mean just for the broader economy? Do you think it's more just because inflation's coming down? Do y ou think it's because
the Fed's just got to react to an even tougher economy and still some of those storm clouds that might be out there? Just kin d of your general
thinking about the other read -throughs of what lower rates quicker will mean for the broade r economy.",2023,1
3,2,Jamie Dimon,"Chairman, Chief Executive Officer",JPMorgan Chase & Co.,"Well first of all, I don't quite believe it. So the Fed has the rate curve, the forward short -term rate curve, almost at 1% higher than what the
market has. So one of the things you got to always prepare for is – it could be anything, we don't know what the rate curve is going to be in a
year. And so we're quite cautious in that and quite thoughtful about that. Obviously, the short -term read is higher recessionary risk and then
inflation coming dow n. So I think inflation will come down a little bit, but it could easily be stickier than people think and therefore, the rat e
curve will have to go up a little bit.",2023,1
4,2,Ken Usdin,Analyst,Jefferies LLC,Okay. Thank you very much.,2023,1
0,3,John McDonald,Analyst,Auton omous Research,"Hi, thanks. Jeremy, wanted to follow up again on the drivers of the NII revision and the lower rates paid assumption. You men tioned the Fed
cuts coming sooner and positive feedback on the customer offers. What about the March events? Do t he bank failures there that happened in
March – in your view, do they slow the reprice intensity because folks are moving other than price reasons? Or they intensify it indu stry-wide
because smaller banks have to reprice to keep their deposits? How do thos e events influence your view of the reprice?",2023,1
1,3,Jeremy Barnum,Chief Financial  Officer,JPMorgan Chase & Co.,"Yeah. John, it's a really good question, and we've obviously thought about that. But as we sit here today, I guess I have two  answers to that.
One is it's not meaningfully affecting our current outlook – we don't see it as  a major driver. And I think in terms of the larger dynamics that you
lay out, it's just a little too early to tell. But from where we are right now, the base case is no real impact.",2023,1
2,3,John McDonald,Analyst,Autonomous Research,"Okay. And then I wanted to ask Jamie – there's a narrative out there that the industry could see a credit crunch – banks are going to stop
lending, even Jay Powell mentioned that as a risk. Do you see that in terms of anything you look at in terms of lending and i s that a reaction
that makes sense – that banks might be retrenching a lot here? Do you worry about that for the economy in terms of credit crunch? Thanks.",2023,1
3,3,Jamie Dimon,"Chairman, Chief Executive Officer",JPMorgan Chase & Co.,"Yeah. I wouldn't use the word credit crunch if I were you. Obviously, there's going to be a little bit of tightening, and most of that will be around
certain real estate things. And you've heard it from real estate investors already, so I just look at that as a kind of thumb  on the scale. It just
makes the Fed's conditions be a little bit tighter , it increases the odds of a recession – that's what that is. It's not like a credit crunch.",2023,1
0,4,Erika Najarian,Analyst,UBS S ecurities LLC,"Hi. Good morning. My first question is you mentioned that your reserve build was driven mostly by worse economic assumptions.  I'm
wondering if you could update us on what unemployment rate you're assuming in your reserve.",2023,1
1,4,Jeremy Barnum,Chief Financial Officer,JPMorgan Chase & Co.,"Yeah. So, Erika, as you know, we take – not going to go into a lot of detail here – but we take the outlook from our economists, we run a
bunch of different scenarios and we probability -weight those. The central case outlook from ou r research team hasn't actually changed, but we
felt that in line with what Jamie just said in terms of a little bit of tightening as a result of the events of March, it mad e sense to add a little bit of
weight to our relative adverse case. So we did that,  which changed the weighted -average expectation. And I think that the weighted -average
peak unemployment that we're using now is something like 5.8%.",2023,1
2,4,Erika Najarian,Analyst,UBS Securities LLC,"So, as you think about all of what you've just told us – so $81 billion of NII this year, and who knows when medium -term is going to happen of
mid-70s, the clear strength of the franchise producing 23% ROTCE in a quarter where your CET1 is 13.8% and a reserve that already  reflects
5.8% unemployment. As we think about recession and what JP Morgan can earn in a recession, do you think you can hit 17% ROTCE even in
2024 – assuming we do have a recession in 2024 as everybody is expecting – given all these revenue dynamics and how prepared you are on
the reserve?",2023,1
3,4,Jeremy Barnum,Chief Financial Officer,JPMorgan Chase & Co.,"Yeah. I mean that's an interesting question, Erika. I guess I'll say a couple things.",2023,1
4,4,Jamie Dimon,"Chairman, Chief Executive Officer",JPMorgan Chase & Co.,"It's a great question, so I want to see how Jeremy answers it.",2023,1
5,4,Jeremy Barnum,Chief Financial Officer,JPMorgan Chase & Co.,"Okay. Let's take a crack. Let's see what the boss thinks. I think number one, we believe, have said, and continue to believe that this is
fundamentally a 17% through the cycle ROTCE franchise, so number one. Number two, as Jamie always says, we run this company f or all
different scenarios and to have it be as resilient as possible across all different scenari os.
On the particular question of ROTCE expectations in 2024 contingent on the particular economic outlook, obviously it depends a lot on the
nature of the recession. I think we feel really good about how the company is positioned for a recession, but we' re a bank. A very serious
recession is of course going to be a headwind for returns, but we think even in a fairly severe recession, we'll deliver very  good returns –
whether that's 17% or not is too much detail for now.",2023,1
6,4,Erika Najarian,Analyst,UBS Securities LLC,Thank you.,2023,1
0,5,Jim Mitchell,Analyst,Seaport Global Securities LLC,"Hey. Good morning. Maybe just a little bit on the deposit, your thought process there. You've seen some inflows. Why do you t hink that you
lose them going forward? And just maybe talk a little bit about the dynamic in pricing – do you feel like given the inflows, do you see some
pricing power for the larger banks?",2023,1
1,5,Jeremy Barnum,Chief Financial Officer,JPMorgan Chase & Co.,"Yeah. A couple things there. So, first of all, we don't know. Right? The deposits just came in. We don't know. We're guessing. Number two, the
deposits just came in. So, by definition, these are somewhat flighty deposits because they just came into us, so it's prudent  and appropriate for
us to assume that  they won't be particularly stable. Number three, there's a natural amount of internal migration of deposits to money funds so
you have to overlay that and that's embedded in our assumptions. And number four, it's a competitive market, and it's entirel y possible that
people temporarily come to us and then over time decide to go elsewhere. So, for all of those reasons, we're just being reali stic about the
stickiness of it.",2023,1
2,5,Jamie Dimon,"Chairman, Chief Executive Officer",JPMorgan Chase & Co.,"If I add, I would say, categorically, there's no pricing power that the bigger banks have because if you look at the pricing – and we look at
pricing sheets all the time – every bank is in a slightly different position and every bank is competing in three -month, six -month, nine -month
savings rates. And then you have the online banks, you got treasury bills, you got money market funds. There's no pricing pow er for the bank,
but obviously we all have different franchises and we're all in a slightly different position.",2023,1
3,5,Jim Mitchell,Analyst,Seaport  Global Securities LLC,"No, fair – all fair points. And maybe just a follow -up on John's question on the lending environment. You talked about the industry likely pulling
back. Are you changing your underwriting standards in any way? Just trying to think  through is there potential for some market share gains
given your strength of capital and liquidity? Or how you're thinking about the loan environment?",2023,1
4,5,Jamie Dimon,"Chairman, Chief Executive Officer",JPMorgan Chase & Co.,"I'd say very modestly, but we look at that all the time.",2023,1
