question_order,question_answer_group_id,speaker,role,company,content,year,quarter
5,4,Jeremy Barnum,Chief Financial  Officer,JPMorgan Chase & Co.,"Thanks, Glenn.",2024,2
0,5,Matt O'Connor,Analyst,Inc.,"Good morning. I was just wondering if you can elaborate on essentially the math behind the ROTCE being too high at 20% and mo re
normalized at 17%. Obviously, you've pointed to overearning on NII. And I guess, the question is, is that all of it to go from 20% to 17%? And i f
so, is that all consumer deposit costs or are there a few other components that you could help frame for us?",2024,2
1,5,Jeremy Barnum,Chief Financial  Officer,JPMorgan Chase & Co.,"Sure. Good question, Matt. I mean, I guess, the way I think about it is a couple of things, like our returns tend to be a bit  seasonal, right? So, if
you kind of build yourself out a full -year forecast and make reasonable,  just based on your own or analyst consensus or whatever and you
think about fourth quarter, like better look at this on a full -year basis when you think about the returns than the quarterly numbers and you
obviously have to strip out kind of the one -time items. And so, if you do that, like whatever you get for this year, is still clearly a number that's
higher than the 17%. So, yeah, one source of headwinds is normalization of the NII, primarily as a result of expected higher deposit costs.
That's – we've talked about that. Part of it is also the yield curve effects. Some cuts will come into the curve at some point.
And in the normal course, if you kind of do a very, very, very simple mental model of the company, you would have, like reven ues growing at
some organic GDP, like rate maybe higher, and expenses growing at a similar slightly lower rate producing a sort of relatively stable overhead
ratio. But even if the amount of NII normalization winds up being less than we might have thought at some prior poi nt, you still have some
background – you still have some normalization of the overhead ratio that needs to happen. So, as much as our discipline on expense
management is as tight as it always has been there, inflation is still non -zero. There are still inv estments that we're executing. There's still
higher expense to come in a slightly flatter revenue environment as a result of, in part, the normalization of NII.
And then, the final point is that whatever winds up being the answer on Basel III Endgame and all the other pieces, you have to assume some
amount of expansion of the denominator, at least based on what we know so far. So, of course, any of those pieces could be wr ong, but that's
kind of how we get to our 17%. And if you look at the various scenari os that we showed on the last page of my Investor Day presentation, it
illustrates those dynamics and also how much the range could actually vary as a function of the economic environment and othe r factors.",2024,2
2,5,Matt O'Connor,Analyst,Inc.,"Yeah, that was a really helpful chart. Just the one follow -up, on the yield curve effects, I guess, what do you mean by that because right now
the yield curve is inverted, maybe you're still breathing in the impact of that. But kind of longer term, you'd e xpect little bit of steepness of the
curve, which I would think would help. But what did you mean by that? Thank you.",2024,2
3,5,Jeremy Barnum,Chief Financial Officer,JPMorgan Chase & Co.,"Yeah. I mean, you and I have talked about this before, I guess. I sort of – I guess, I don't really agree fundamentally with the notion that the
way to think about things is that sort of yield curve steepness above and beyond what's priced in by the forewords is a sourc e of structural NII
or NIM for banks, if you know what I mean. Like, I mean, pe ople have different views about the so -called term premium and obviously, in a
moment of inverted curve and different types of treasury supply dynamics, people's thinking on that may be changing.
But I think we saw when rates were at zero and the 10 -year note was below 2%, everyone sort of – many people were kind of tempted to try to
get extra NIM, extra NII by extending duration a lot. But when the steepness of the curve implies, it is driven by the expect ation of actually
aggressive Fed tightening, it's just a timing issue and you can wind up kind of pretty offsides from a capital and other perspectives, so.
There're some interesting questions about whether fiscal dynamics might result in a structurally steeper yield curve down the  road and
whether that c ould be sort of earning the term premium, so to speak, could be a source of NII. But that feels a bit speculative to me at th is
point.",2024,2
4,5,Matt O'Connor,Analyst,Inc.,Got it. Okay. Thank you for the details.,2024,2
5,5,Jeremy Barnum,Chief Financial Officer,JPMorgan Chase & Co.,"Thanks, Matt.",2024,2
0,6,Mike Mayo,Analyst,Wells Fargo Securities LLC,"Hi. Jeremy, you said it's too early to end the overearning narrative and you highlighted higher deposit costs and the impact of lower rates and
lower NII and DCM pull-forward and credit costs going higher. Anything I'm missing in that list? And what would cause you to end the
overearning narrative?",2024,2
1,6,Jeremy Barnum,Chief Financial Officer,JPMorgan Chase & Co.,"No. Actually, I think that is the right list, Mike. I mean, frankly, I think one thi ng that would end the overearning narrative is if our annual returns
were closer to 17%. I mean, to the extent that that is the through the cycle number that we believe and that we're currently producing more
than that, that's one very simple way to look a t that. But the pieces of that are the pieces that you talked about and the single most important
piece is the deposit margin. Our deposit margins are well above historical norms, and that is a big part of the reason that w e still are
emphasizing the overe arning narrative.",2024,2
2,6,Mike Mayo,Analyst,Wells Fargo Securities LLC,"Your 17% through the cycle ROTCE expectation, what is the CET1 ratio that you assume for that?",2024,2
3,6,Jeremy Barnum,Chief Financial  Officer,JPMorgan Chase & Co.,"I mean, we would generally assume requirements plus a reasonable buffer, which, depending on the shape of rules, could be a l ittle bit
smaller or a little bit bigger and no small part is a function of the volatility of tho se rules, which goes back to my prior comments on SCB and
CCAR. But obviously, as you well know, what actually matters is less the ratio and more the dollars and at this point, the do llars are very much
a function of where rules land and where the RWA land s and obviously, things like GSIB recalibration and so on. So, we've done a bunch of
scenario analysis along the lines of what I did at Investor Day that informs those numbers. But that is obviously one big ele ment of uncertainty
behind that 17%, which is why at Investor Day when we talked about it, both Daniel and I were quite specific about saying that we thought
17% was still achievable, assuming a reasonable outcome on the Basel III Endgame.",2024,2
4,6,Mike Mayo,Analyst,Wells Fargo Securities LLC,"Let me just zoom out for one more question on the return target. I mean, when I asked Jamie at the 2013 Investor Day, would it make sense to
have 13.5% capital, he was basically telling me to take a hike, right? And now, you have 15.3% capital and you're saying, wel l, we might want
to have  a lot more capital here. I mean, at some point, if you're spending $17 billion a year to improve the company, if you're gaini ng share
with digital banking, if you're automating the back office, if you're moving ahead with AI, if you're doing all these thi ngs that I think you say
others aren't doing, why wouldn't those returns go higher over time or do you just assume you'll be competing those benefits away? Thanks.",2024,2
5,6,Jeremy Barnum,Chief Financial Officer,JPMorgan Chase & Co.,"Yeah. I mean, I think in short, Mike, and we've talked abo ut this a lot and Jamie's talked about this a lot, it's a very, very, very competitive
market, and we're very happy with our performance. We're very happy with the share we've taken, and 17% is like an amazing nu mber
actually. And like, to be able to do th at, given how robust the competition is from banks, from non -banks, from U.S. banks, from foreign banks,
and all of the different businesses that we compete in, is something that we're really proud of. So, the number has a range a round it,
obviously. So, i t's not a promise, it's not a guarantee, and it can fluctuate. But we're very proud to be in the ballpark of being able to th ink that
Jeremy Barnum
Chief Financial Officer, JPMorgan Chase & Co.  A
we can deliver it, again, assuming a reasonable outcome on Basel III Endgame. But it's a very, very, very competitive mark et across all of our
products and services and regions and client segments.",2024,2
6,6,Mike Mayo,Analyst,Wells Fargo Securities LLC,All right. Thank you.,2024,2
0,7,Betsy L. Graseck,Analyst,Morgan Stanley & Co. LLC,"Hi, Jeremy. Hi, Jeremy.",2024,2
1,7,Jeremy Barnum,Chief Financial  Officer,JPMorgan Chase & Co.,"Hi, Betsy.",2024,2
2,7,Betsy L. Graseck,Analyst,Mor gan Stanley & Co. LLC,"So, I did want to ask one drill -down question on 2Q, and it's related to the dollar amount of buybacks that you did do. I think in the press
release, right, in the slide deck, it's $4.9 billion common stock net repurchases. So, the  question here is, what's the governor for you on how
much to do every quarter? And, I mean, I understand it's a function of, okay, how much do we organically grow. But even with that, so you get
the organic growth, which you had some nice movement there. But you do the organic growth and then is it how much do we earn and we
want to buy back our earnings or how should we be thinking about what that repurchase volume should be looking like over time ? And I
remember over at Investor Day the whole debate arou nd I don't want to buy back my stock, but we are, right? So, I get this question from
investors quite a bit of how should we be thinking about how you think about what the right amount is to be doing here.",2024,2
3,7,Jeremy Barnum,Chief Financial  Officer,JPMorgan Chase & Co.,"Yeah. That's a very good and fair question, Betsy. So, let me try to unpack it to the best of my ability. So, in no particula r order, one thing that
we've really tried to emphasize in a number of different settings, including in our recent 10 -Qs actually i s that we don't want to get into the
business of guiding on buybacks. So, we're going to buy back whatever we think makes sense in the current moment sort of and we reserve
the right to sort of change that at any time. So, I recognize that not everyone lov es that, but that is kind of a philosophical belief and so, I might
as well say it explicitly. It was pretty clear in the Q also, but I'm just going to say that again. So, that's point one.
But having said that, let me nonetheless try to address your poin t on framework and governors. So, generally speaking, we think it doesn't
make sense to sort of exit the market entirely unless the conditions are much more unusual than they are right now, let's say . Obviously, when
for whatever reason, if we ever need to  build capital in a hurry, we've done it before and we're always comfortable suspending buybacks
entirely. But I think some modest amount of buybacks is a reasonable thing to do when you're generating your kind of capital.  And so, we were
talking before ab out this $2 billion pace. We're kind of trying to move away from this notion of a pace, but that's where that idea comes from ,
let's put it that way.
You talked about the $4.9 billion, which I recognize may seem like a little bit of a random number. But w here that actually comes from is the
other statement that we've made that we have these significant item gains from Visa. And if you think about what that means, it means that we
have, post the acceptance of the exchange offer, a meaningful long position a nd a liquid large cap financial stock, i.e., Visa, which realistically
is highly correlated to our own stock. And so, in some sense, why carry that instead of just buying back JPMorgan stock. So, we talked about
– Jamie talked about, as we liquidate the Vi sa, deploying those proceeds into JPM and that’s what we did this quarter. So, that is why the $4.9
billion is a little higher, and it’s consistent with my comments at Investor Day around having slightly increased the amount of buybacks.
Jeremy Barnum
Chief Financial  Officer, JPMorgan Chase & Co.  A
And beyond that, what you’re left with is my answer to Steve’s question, which is that, to your point about buying back earnings or whatever,
when we’re generating these types of earnings and there’s this much organic capital being generated in the absence of opportu nities  to deploy
it organically or inorganically and while continuing to maintain our healthy, but sustainable dividend, if we don’t return th e capital we are going
to keep growing the CET1 ratio to levels, which, if you think about the long strategic outlook of  the company, are not reasonable. They’re just
artificially high and unnecessary. So, one way or the other, that will need to be addressed at some point. It’s just that we don’t feel that now is
the right time.",2024,2
4,7,Betsy L. Graseck,Analyst,Morgan Stanley & Co. LLC,"All right. Thank you, Jeremy. Appreciate it.",2024,2
5,7,Jeremy Barnum,Chief Financial Officer,JPMorgan Chase & Co.,"Thanks, Betsy.",2024,2
0,8,Gerard Cassidy,Analyst,RBC Ca pital Markets LLC,"Hi, Jeremy. How are you?",2024,2
1,8,Jeremy Barnum,Chief Financial Officer,JPMorgan Chase & Co.,"Hi, Gerard.",2024,2
2,8,Gerard Cassidy,Analyst,RBC Capital Markets LLC,"Jeremy, I know you touched on deposits earlier in the call in response to a question. I noticed on the average balances the n on-interest -
bearing deposits were relatively stable quarter -to-quarter versus prior quarters wh en they’ve steadily declined. And this is one of the areas, of
course, investors are focused on in terms of the future of the net interest margin for you and your peers. Can you elaborate,  if you can, what
you’re seeing in that non -interest -bearing deposit  account? I know this is average and not period, and the end number may actually be lower.
But what are you guys seeing here?",2024,2
3,8,Jeremy Barnum,Chief Financial Officer,JPMorgan Chase & Co.,"Yeah. Good question, Gerard. I have to be honest,  I hadn’t focused on that particular sequential explain, i.e., quarter -on-quarter change and
average non -interest -bearing deposits. But I think the more important question is the big picture question, which is what do we expect? How
are we thinking about o ngoing migration of non -interest -bearing into interest -bearing in the current environment and how that affects our NII
outlook and our expectation for weighted average rate paid on deposits?
And the answer to that question is that, we do continue to expec t that migration to happen. So, if you think about it, in the Wholesale space,
you have a bunch of clients with some balances and non -interest -bearing accounts, and over time for a variety of reasons, we do see them
moving those balances into interest -bearing. So, we do continue to expect that migration to happen and therefore, that will be a source of
headwinds. And that migration sometimes happens internally, i.e., out of non -interest -bearing into interest -bearing or into CDs. Sometimes, it
goes into mone y markets or into investments, which is what we see happening in our Wealth Management business and some of it does leave
the company. But one of the things that we're encouraged by is the extent to which we are actually capturing a large portion of that y ield-
seeking flow through CDs and money market offerings, et cetera, across our various franchises. So, big picture. I do think th at migration out of
Jeremy Barnum
Chief Financial  Officer, JPMorgan Chase & Co.  A
non-interest -bearing into interest -bearing will continue to be a thing and that is a contributor to the mo dest headwinds that we expect for NII
right now. But, yeah, I'll leave it at that, I guess.",2024,2
4,8,Gerard Cassidy,Analyst,RBC Capital Markets LLC,"Very good. And as a follow -up, you've been very clear about the Consumer Credit Card charge -offs and delinquency levels, and we all know
about the Commercial Real Estate Office. And you always talk about overearning on net interest income, of course. One o f the great credit
quality stories for everyone, including yourselves, is the C&I portfolio, how strong it's been in this elevated rate environm ent? And I know your
numbers are still quite low, but in the Corporate and Investment Bank, you had about a $500  million pickup in non -accrual loans. Can you
share with us what are you seeing in C&I? Are there any early signs of cracks or anything? And, again, I know your numbers ar e still good, but
I'm just trying to look forward to see if there's something here ov er the next 12 months or so.",2024,2
5,8,Jeremy Barnum,Chief Financial Officer,JPMorgan Chase & Co.,"Yeah. It's a good question. I think the short answer is no. We're not really seeing early signs of cracks in C&I. I mean, yes , I agree with you,
like the C&I charge -off rate has been very, very  low for a long time. I think we emphasized that at last year's Investor Day, if I remember
correctly. I think the C&I charge -off rate we've seen in 10 years was something like literally zero. So, that is clearly very low by historical
standards. And while  we take a lot of pride in that number and I think it reflects the discipline in our underwriting process and the strength of
our credit culture across the bankers and the risk team, that's not – we don't actually run that franchise to like a zero loss exp ectation. So, you
have to assume there will be some upward pressure on that. But in any given quarter, the C&I numbers tend to be quite lumpy a nd quite
idiosyncratic. So, I don't think that anything in the current quarter's results is indicative of anythin g broader, and I haven't heard anyone
internally talk that way, I would say.",2024,2
6,8,Gerard Cassidy,Analyst,RBC Capital Markets LLC,Great. Appreciate the insights as always. Thank you.,2024,2
7,8,Jeremy Barnum,Chief Financial  Officer,JPMorgan Chase & Co.,"Thanks, Gerard.",2024,2
0,9,Erika Najarian,Analyst,UBS Securities LLC,"Hi, good morning. I just had one clean -up question, Jeremy. The consensus provision for 2024 is $10.7 billion. Could you maybe clarify for
once and for all sort of Jamie's comments a t an industry conference earlier and try to sort of triangulate if that $10.7 billion provision is
appropriate for the growth level that you are planning for in Card?",2024,2
1,9,Jeremy Barnum,Chief Financial  Officer,JPMorgan Chase & Co.,"Yeah. Happy to clarify that. So, Jamie's comments were that the allowance – the build and the Card allowance, so we're talking about Card
specifically, we expected something like $2 billion for the full year. As I sit here today, our expectation for that n umber is actually slightly
higher, but it's in the ballpark. And I think in terms of what that means for the consensus on the overall allowance change f or the year, last time
I checked, it still looked a little low on that front. So, who knows what it'll a ctually wind up being, but that remains our view.
One question that we've gotten is how to reconcile that build to the 12% growth in OS that we've talked about because it seem s like a little bit
high relative to what you would have otherwise assumed if yo u apply some sort of a standard coverage ratio to that growth. But the reason
Jeremy Barnum
Chief Financial  Officer, JPMorgan Chase & Co.  A
that's the case is essentially a combination of higher revolving mix, as we continue to see some normalization revolve in tha t 12%, as well as
seasoning of earlier vintages, whic h comes with slightly higher allowance per unit of OS growth.",2024,2
2,9,Erika Najarian,Analyst,UBS Securities LLC,Great. Thank you.,2024,2
3,9,Jeremy Barnum,Chief Financial Officer,JPMorgan Chase & Co.,"Thanks, Erika.",2024,2
0,10,Jim Mitchell,Analyst,Seaport Global Securities LLC,"Oh, hey, good morning. Maybe just one last question on sort of deploying excess capital. It seems like the two primary ways t o do that
organically would be through the trading book or the loan book. So, maybe two questions there. One, trading assets were up 20% year -over-
year. Is that you leaning into it or just a function of demand? And is there further opportunities to grow that?
And then, secondly, outside of Card, loan demand has been quite weak and any thoughts from yo u on if you're seeing any change in demand
or how you're thinking about loan demand going forward? Thanks.",2024,2
1,10,Jeremy Barnum,Chief Financial Officer,JPMorgan Chase & Co.,"Thanks, Jim. Good questions. So, yeah, trading assets have been up. That is basically client activity, primarily secured fina ncing -related sort
of matchbook repo -type stuff and similar things that are – gross up the balance sheet quite a bit, but are quite  low risk and therefore, quite low
RWA intensity. So, while our ability to supply that financing to clients is something that we're happy about and it's very mu ch represents us
leaning into the franchise to serve our clients. It's not really particularly R WA and therefore, capital intensive and therefore, doesn't really
reflect an aggressive choice on our part to deploy capital, so to speak.
On the loan demand front, yeah, I mean, unfortunately, I just don't have much new to say there on loan demand, meani ng, to your point, loan
demand remains quite muted everywhere except Card. Our Card business is, of course, in no way capital constrained. So, whatev er growth
makes sense there in terms of our customer franchise and our ability to acquire accounts and reta in accounts and what fits inside our credit
risk appetite, is growth that's going to make sense. And so, we're very happy to deploy capital to that. But it's not constra ined by our
willingness or ability to deploy capital to that.
And, of course, for the rest of the loan space, the last thing that we're going to do is have the excess capital, meaning tha t we lean into lending
that is not inside our risk appetite or inside our credit box, especially in a world where spreads are quite  compressed and terms are under
pressure. So, there's always a balance between capital deployment and assessing economic risk rationally and frankly, that is , in some sense,
a microcosm of the larger challenge that we have right now. When I talked about if  there was ever a moment where the opportunity cost of not
deploying the capital relative to how attractive the opportunities outside the walls of the company are, now would be it in t erms of being
patient. That's a little bit one example of what I was ref erring to.",2024,2
2,10,Jim Mitchell,Analy st,Seaport Global Securities LLC,Right. Okay. Great. Thanks.,2024,2
3,10,Jeremy Barnum,Chief Financial  Officer,JPMorgan Chase & Co.,"Thanks, Jim.",2024,2
0,11,Jeremy Barnum,Chief Financial Officer,JPMorgan Chase & Co.,"Very good. Thank you, everyone. See you next quarter.",2024,2
0,1,Jim Mitchell,Analyst,Seaport Global Securities LLC,"Hey, good morning. So, Jeremy, as you highlighted, full year NII guidance implies a sizable drop in Q4 NII ex. Markets about 6%. So, can you
just maybe discuss what are the largest drivers of the sequential decline including any initial thoughts on deposit  behavior and pricing since
the 50 basis point cut?
And since it's related, I'll just throw out my follow -up question. I realize the forward curve is moving around a lot, but since Dan brought it up a
month ago, can you frame how you're thinking about the NII trajectory for 2025? Thanks.",2024,3
