question_order,question_answer_group_id,speaker,role,company,content,year,quarter
10,7,Jeremy Barnum,Chief Financial Officer,JPMorgan Chase & Co.,"Yeah. Okay. That's a good question, Erika. I think there's a couple pieces in there, so let me take the most important piece first, which  is the
17% through the cycle target. Are we keeping that or not in light of the Basel III Endgame proposal? So, short answer is we 're not going to
change that number today, but when you look at what we've disclosed about a 25% increase in capital, you have to start by ack nowledging
that that is a major headwind to returns.
Jeremy Barnum
Chief Financial Officer, JPMorgan Chase & Co.  A
In simple terms, you talk about earnings power and returns, but they're two different things, right. We have to be a little bit pedantic and do
numerator and denominator here. Okay, so say the numerator doesn't change. If you just dilute down the numerator by the incre ased capital,
that's a significantly lower retu rn number.
I would say that that's probably the lower bound in terms of the impact of the Basel III Endgame for a couple reasons. One is , we are hoping
for changes. Two is, once the rule is final, we will seek to reprice in the places where we can. And th at'll be different in Consumer and
Wholesale, some of it will be product level, some of it will be relationship level, but that hopefully can mitigate some of i t but of course the flip
side of that is that's cost getting passed into the real economy and th at's part of the point that we've made about lowering availability of
products and services and lending. There may be some opportunities for costless optimization. I'm personally a little bit mor e pessimistic about
those, but we've surprised ourselves on t hose points in the past, so we'll see.
And then finally, yeah, we may stop doing certain things and we may exit things. But, I wouldn't necessarily assume that that 's going to do a lot
to preserve returns at the 17%. That's going to be about exiting thing s that are shareholder -destructive, but not necessarily producing much
higher returns, if you know what I mean.
So that's that, and then the other part of your question implicitly was talking about organic capital generation and I think it's just very imp ortant
to separate impacts on the economy and impacts on long -term returns from our ability to meet the requirements. Of course, as Jamie always
says, JPMorgan is going to be fine and we're building a lot of capital and we were managing capital conservativ ely and we'll be able to build
the necessary capital in order to achieve on -time or early compliance, which is always what we strive to do, but that doesn't really have any
particular bearing on the question of what the long -term return target is or the im pacts on the real economy.",2023,3
11,7,Erika Najarian,Analyst,UBS Securities LLC,Got it. Thank you.,2023,3
0,8,Glenn Schorr,Analyst,Evercore ISI,"Hi. Thank you. So I very much appreciate the comments in the release on the big picture things, what's going on in the world and their
potential impact on markets, on food ma rkets, global trade, everything that you mentioned, and sadly agree about the most dangerous time in
decades. The question I have is, does it surprise you that markets are hanging in, that you, yourself, have green shoots or s till green shoots
type of mind set about banking while that's going on? And then maybe more importantly, if you believe what obviously what you wrote, what
are you doing about it? How do you manage yourself conservatively? How do you prepare for tougher times?",2023,3
1,8,Jamie Dimon,"Chairman, Chief Executive Officer",JPMorga n Chase & Co.,"Go ahead, Jeremy.",2023,3
2,8,Jeremy Barnum,Chief Financial  Officer,JPMorgan Chase & Co.,"You want to start? Okay. So, I mean, on green shoots, you'll just note that our comments are cautious. I mean, there is momen tum. I do think
we are a little bit more optimistic than we were, but obviously, markets have bee n bumpy, both equity markets and rate markets have been
very whippy recently. So we don't want to get too carried away with optimism here. We are coming in off a very low base and s o there's a
hope and an expectation that we are on the path to normalizatio n and improvement. And of course, the overall economic picture at least
currently looks solid, this sort of immaculate disinflation trade is actually happening. So those are all reasons to be a lit tle bit optimistic in the
near-term, but it's tempered with quite a bit of caution.",2023,3
3,8,Jamie Dimon,"Chairman, Chief Executive Officer",JPMorgan Chase & Co.,"So I would add a question. There has been an extraordinary amount of fiscal monetary stimulus still in the system, and you can't look at, and
of course, it can drive markets in sentiment and sales and profits and all that, but you can't stay like this forever. Betwee n QT, if you never had
and how much the fiscal stimulus could continue at this rate before you h ave kind of the crowding out kind of factor. So I think people have to
be very cautious, and of course, the geopolitics I think is just an extraordinary issue we have to deal with. How do you prep are the company
for that?
We do 100 stress tests a week, an d we do multiple views of it, including geopolitical problems, interest rate problems, but usually, geopolitics
presents itself as a deep recession or a mild recession, or a recession part of the world, or markets going down a lot, and b ecause markets do
well is not a reason, ever, to say that they are going to continue to do well.
If you don't believe me, remember 1987, 1990, 1994, the year 2000, the year 2009, and people don't predict those inflection p oints. But my
caution is that we are facing so many uncertainties out there. You just got to be very cautious with what you're facing. And like I said, the other
thing about the green shoots, regardless of that, we try to run the company so that we serve the clients day in and day out, better products and
better services, securely, safely, and all those things, so that's the ultimate goal.
We know there are going to be bad times. That's not a surprise that there are going to be bad times. We don't always know how they're
coming, and where they're coming fro m, but we'll keep on serving clients and doing good for clients, you can build a good business kind of
separate from what it does to your returns. That's a slightly different issue at this point, but we'll deal with that too whe n we figure out what to
do.",2023,3
4,8,Glenn Schorr,Analyst,Evercore ISI,"Thank you for all that, all good.",2023,3
5,8,Jeremy Barnum,Chief Financial Officer,JPMorgan Chase & Co.,"Thanks, Glenn.",2023,3
0,9,Mike Mayo,Analyst,Wells Fargo Securities LLC,"Hi. I understand the NII strategy benefited from First Republic, asset sensitivity, CD strategy, money in motion, and I'm cur ious to how much is
the NII increase and the deposit benefits a function of the 67 million digital banking customers? Do you have more digital banking cu stomers
than branch customers now? If you can just refresh that.
And then a more general question. I guess I have the first one fo r Jeremy and the second one for Jamie. You have record tech spend. What's
the benefit of having record tech spend, if you can kind of mark -to-market your thoughts there as it relates to AI, as it relates to maybe wasted
spending, your outlook for next year ? And does it really help to be the biggest tech spender in the banking industry?",2023,3
1,9,Jeremy Barnum,Chief Financial Officer,JPMorgan Chase & Co.,"Yes. Let me do digital banking, Mike. I spent some time on this actually a couple weeks ago. And it's interesting to note thi s sort of extent to
which the growth in digitally engaged consumers is higher than the overall growth in consumer accounts, meaning that we're co ntinuing to
increase the percentage of our consumers that are digitally engaged. And it sort of goes back to my prior poi nt...",2023,3
2,9,Jamie Dimon,"Chairman, Chief Executive Officer",JPMorgan Chase & Co.,But the percent who are digital only is much lower than that .,2023,3
3,9,Jeremy Barnum,Chief Financial Officer,JPMorgan Chase & Co.,"For sure. For sure. Which actually links to the broader point that what – in terms of your question about how much is this helping the current
NII story, it goes to the larger point of it holistic through the cycl e, multichannel, fully engaged customer strategy which requires a lot of
investment in branches, obviously, but also in digital services of all sorts. So in many ways, you can see the current enviro nment as a little bit
of a payoff of that investment. But that's not like, therefore, we stop investing, obviously.
So I guess that's part of the answer. And I guess your other question is the benefits of being the biggest tech spender. I ju st think like it's sort
of mandatory, right? I mean we're big and it's a  very technology -centric business , and the world is competitive, and everything is changing.
Younger generations have different expectations, and we have to be nimble, and we have to be on our front foot. And otherwise , we risk
getting severely disrupted. So I don't know if Jamie wants to add anything.",2023,3
4,9,Jamie Dimon,"Chairman, Chief Executive Officer",JPMorgan Chase & Co.,"Just the competition, when we look at it, it's Wells, who's coming back, which I'm happy for you guys. It's obviously Marcus,  it's Apple, it's
Chime, it's Dave. Ther e are a lot of people coming up after these businesses in different ways, and there some have been quite successful.
It's Stripe in payments. And so we want to be very good and very competitive. Some of that tech spending is things which are almost a sine
qua non, which is cybersecurity, data center resiliency, regulatory requirements, and things like that, which we simply are g oing to do and be
very, very good at to protect the company.",2023,3
5,9,Mike Mayo,Analyst,Wells Fargo Securities LLC,"As it relates to AI specifically, which is the tal k of the town, I guess the consensus among people outside the banking industry is that banks will
not win that battle, including JPMorgan. You won't control the front end. What are you doing with AI to make a difference now , or is this just
simply a moon s hot?",2023,3
6,9,Jamie Dimon,"Chairman, Chief Executive Officer",JPMorgan Chase & Co.,"Oh, I don't agree with that statement. Banks have an extraordinary amount of proprietary data in addition to when you do like  a large language
model, that's public data, looking at everything on the internet or ev erything that's ever been published or something like that. But AI is an
extraordinarily good tool to use. We just put a woman who's running it at our table. So it's data analytics, AI, et cetera. A nd there are multiple
types of AI. So we use AI for risk, fraud, marketing, prospecting. And the management team's getting better and better at saying how can we
use the data to do a better job to reduce errors, to serve clients better, to have a salesperson have co -pilots so they know to widen the client's
coin or something like that. And so, we simply have to do it. Does it create opportunity for disruptors to come in? Yeah, of cours e. That's
always been true with technology. And, but, we'll be quite good at it .",2023,3
7,9,Mike Mayo,Analyst,Wells Fargo Securities LLC,"And then lastly, I think you h ad made a mention at a conference about investment spend or tech spend over the next year. Where do you
stand on that?",2023,3
8,9,Jeremy Barnum,Chief Financial Officer,JPMorgan Chase & Co.,"Yeah. Now because you did ask a little bit about the expense outlook for next year. So I think at the conference we said, I think the consensus
was $88 billion, but we're still going through the budget process, et cetera, et cetera. So that's still true. I think we're still kind of in the ballpark,
but I would say at the margin there's going to be a li ttle bit of upward pressure.",2023,3
9,9,Jamie Dimon,"Chairman, Chief Executive Officer",JPMorgan Chase & Co.,"Is that for First Republic too, or no?",2023,3
10,9,Jeremy Barnum,Chief Financial Officer,JPMorgan Chase & Co.,"Yeah, this is all now including First Republic. And I think there will be a little bit of upward pressure on t hat as we sort of do our usual thing and
look at all of the opportunities that we see and the investments that we want to make. So no surprise in that sense that we'r e going to invest
prudently. Nothing dramatic, but probably a little bit of upward pressur e at the margin.",2023,3
11,9,Mike Mayo,Analyst,Wells Fargo Securities LLC,All right. Thank you.,2023,3
12,9,Jamie Dimon,"Chairman, Chief Executive Officer",JPMorgan Chase & Co.,Thank you.,2023,3
0,10,Jim Mitchell,Analyst,Seaport Global Securities LLC,"Hey. Good morning. Jeremy, do you think there's any receptivity among regulators regarding the double counting not only of op erational risk
but I think you alluded to this earlier in the Markets business, but there's clearl y double counting in market risk in the trading book. Is there any
receptivity?",2023,3
1,10,Jamie Dimon,"Chairman, Chief Executive Officer",JPMorgan Chase & Co.,"Can I just answer that real quickly? We don't really know. It's a one -sided conversation generally. They say put it in your comments, so
everyone is going to put in extensive comments, kind of like you heard from Jeremy and we don't really know. We don't really know what's
going on inside the Fed, how many people get involved. In my view, it's become a very politicized process as opposed to the technical
analysis I think is required to do it exactly right. So we'll see.",2023,3
2,10,Jim Mitchell,Analyst,Seaport Global Securities LLC,"Okay. And then if it weren't to change, and you talked about the potential negative impact on liquidity in the Markets busine ss specifi cally, is
that a JPM pulling out of certain businesses type event? Or is it more a comment that there'd be fewer providers of liquidity  as less scaled
players exit, and maybe that's almost equal a market share gain opportunity for JPMorgan in a smaller bus iness?",2023,3
3,10,Jamie Dimon,"Chairman, Chief Executive Officer",JPMorgan Chase & Co.,"I think so if you look at Markets alone, it's a huge, I think 60%, increase in capital. And if you look at it, you can do tha t by product. For some
products it's worse than for others, but general ly it's bad across all products. But the really important thing is market making is a critical
function and if you look at the world, only some of these large market makers who could make markets for governments, hospita ls, cities,
schools, states, IMF, Wo rld Bank, BlackRock, Blackstone, and all those various things who buy and sell for their clients in size. And market
makers have a different function than hedge funds, and I don't know what the real intent was with this. This is another one I  think that ne eds to
be really thought through with what are you trying to accomplish.
We do market making quite safe. We've never lost the kind of money that people talk about in market making in the global mark et shock or
something like that, but the other thing abou t market making, I do agree, it could actually force some people out. It will force lower positions
which is why I think it's a little risky, but it may also force more consolidation. And so clients, since they need it so muc h, there may be
consolidation i n an unintended way in market making and obviously more volatile markets because with all the constraints, with the LCR, SLR,
capital, et cetera, you will constantly be up against limitations in what you can do.",2023,3
4,10,Jeremy Barnum,Chief Financial Officer,JPMorgan Chase & Co.,"Yeah. And I think that last point of Jamie's is particularly important because, sure, if you want, you can construct what I would c onsider a very
optimistic argument that the higher cost of doing business will lead smaller scale players to exit and that's a shar e gain opportunity for us, but
if I refer back to the comments about the disincentives to beneficial diversification and scale, getting bigger, especially i n markets is quite
expensive from, for example, a GSIB perspective, and so you wind up kind of hemme d in on all sides which is one of the reasons why we're
sort of highlighting, but it does seem like the only way out, sometimes, when you look at the cumulative effect of everything  that's happened in
markets over the last 15 years, is a fundamentally very  different system, and while obviously...",2023,3
5,10,Jamie Dimon,"Chairman, Chief Executive Officer",JPMorgan Chase & Co.,"Great opportunity for European market makers. I mean, a great opportunity, like they can do repo and FX and swaps and credit and stuff with
30% less capital. That is a big  difference in that kind of business.",2023,3
6,10,Jim Mitchell,Analyst,Seaport Global Securities LLC,Right. That's helpful. Thanks.,2023,3
0,11,Matt O'Connor,Analyst,Inc.,"Hi, good morning. You talked about increased investment spend in some areas in response to an earlier question. But just how do you think
about cost control overall, looking at the medium term? The outlook for revenue is obviously pressured at least on net interest inc ome. Fees
might help, but the backdrop is for potentially declining revenue or at least flattish revenue for a couple or few years.  So, I know you always
say you want to invest for the cycle, and it's really paid off over time, but how are you thinking about cost control the nex t few years?",2023,3
1,11,Jeremy Barnum,Chief Financial Officer,JPMorgan Chase & Co.,"Yeah. I mean, I wish I had sort of an answer that fit better into your framework. But in some fundamental sense, we just kind of don't agree
with the framework in the sense that and we've been through this over the last couple of years, right? In a world where rates  drop very
suddenly and recover like quite dramatic ally, and credit becomes abnormally good and then rebounds, and you've seen these very significant
fluctuations in capital markets. We  saw that in 2021 going into 2022 where the revenue environment can change a lot in the short term for
reasons that can be  largely out of your control.
And while of course there are parts of our expense base, which are in the short term directly sensitive to the revenue enviro nment and some
of those adjust naturally and some of them we adjust more forcefully as a function of volumes, but other things are much more structural. And
the goal is to make sure that those other things are sized appropriately to what we believe sustainable through the cycle ret urns are. So we're
always very focused on  cost. You can be rest assured of that. That discipline internally is as aggressive as ever as we go through the budget
cycle. But there are long -term plays and you really shouldn’t expect us to see trying to generate cosmetically lower costs in response t o a
lower revenue environment where we didn’t balloon the costs when the revenue became as we’ve argued unsustainably high.",2023,3
2,11,Matt O'Connor,Analyst,Inc.,"Yeah. Fair enough. And if I could just squeeze in on First Republic, obviously the contribution there is coming in multiples higher -than-
expected. How do you think about the puts and takes in terms of, I think there's probably some run -off of loans still to come, but also
opportunities to deepen the relationships there?",2023,3
3,11,Jeremy Barnum,Chief Financial Officer,JPMorga n Chase & Co.,"Yeah. So you're right about the contribution and about the run -off of loans, and it is notable the First Republic related net income that we've
printed this quarter – so the first thing to say is that we don't think that that First Republic related net income number from this quarter is a
sustainable indicator of the future run rate. Some of the same dynamics that we've just talked about, in particular, over -earning on deposits or
sort of above normal on deposit margins, also apply t o the First Republic franchise to some degree. So we would expect that to normalize.
And probably more significantly as the things you alluded to, we do have some accelerated pull to par on some of the commitme nts that we
took on at a fair value discount a s part of the acquisition, so that's a short -term tailwind in the revenue that will come out of that over the next
few quarters.
And yeah, in terms of how it's going overall and deepening the relationships, that remains a focus and I think more of that w ill happen as we
continue the integration and we continue stabilizing. And yeah, I think as I said on the press call, things are going well ar guably a little bit
better than we'd sort of modeled as part of the acquisition, and we're happy to see that.",2023,3
4,11,Matt O'Connor,Analyst,Inc.,Okay. Thank you very much.,2023,3
0,12,Jamie Dimon,"Chairman, Chief Executive Officer",JPMorgan Chase & Co.,Thank you very much.,2023,3
0,1,Matt O’Connor,Analyst,Inc.,Good morning. Thanks for all the comments on the net interest income. Any updates on that medium term outlo ok that you've put out there ?,2023,4
1,1,Jeremy Barnum,Chief Financial Officer,JPMorgan Chase & Co.,"Yeah. Matt, not particularly updating. I think you're referring to that $80 billion number that we'd put out there, and I wou ldn't exactly describe
that as an outlook. I think it's more just a number that we put out there to try to quantify a little bit the extent of the over earning . So, not
particularly necessary to revise the number. But I just would point out, again, as we highlight on the page, and as I hig hlighted in the prepared
remarks, that when you look at that $94 billion exit rate and full year guidance of $88 billion, that implies obviously exiti ng below $88 billion and
some significant sequential decline. So, in that sense, you can see us kind of ma rching on the path to that $80 billion. Whether we ever get to
the $80 billion or not and when is maybe a topic for later in the year or next year .",2023,4
2,1,Matt O’Connor,Analyst,Inc.,"Okay. And then just separately, you bought back couple of billion dollars of stock this quarter. What's your thought process on buybacks given
the strong capital generation, but also some uncertainty on regulatory proposals ?",2023,4
3,1,Jeremy Barnum,Chief Financial Officer,JPMorgan Chase & Co.,"Yeah. Good question. And I think you framed it exactly correctly in the sense that we obviously have a lot of buyback capacity in g eneral
based on our organic capital generation. So, the normal capital hierarchy will apply. But for now, we plan to remain on a mo dest pace of
buybacks consistent with that kind of $2 billion net buyback a quarter number that we've talked about and that you've seen us  do, in light of the
– probably the need to continue building to have a bit of a buffer, as you said, the uncertainty about the finalization of the rules. And also just
as a reminder, the SCB is probably a little bit low right now and has been quite volatile. So, that's another factor that we need to keep in mind .",2023,4
4,1,Matt O’Connor,Analyst,Inc.,Okay. Thank you .,2023,4
5,1,Jeremy Barnum,Chief Financial Officer,JPMorgan Chase & Co.,"Thanks, Matt.",2023,4
0,2,John McDonald,Analyst,Autonomous Research,"Thanks. Jeremy, could you give a little more color on what's baked into the loan loss reserve in terms of kind of weighted av erage
assumptions and how any change in macro outlook played into the dynamics of the reserve builds and releases this quarter ?",2023,4
1,2,Jeremy Barnum,Chief Financial Officer,JPMorgan Chase & Co.,"Yeah. Actually, John, this quarter, that's all like pretty quiet. So, the weighted average unemployment rate number is still 5.5%. We didn't have
any really big revisions in the macro outlook driving the numbers, and our skew remains as it has been – a little bit skewed to the downside.
Just recognizing that we still see risks being elevated, which obviously you can see that skew in the difference between the weighted average
unemployment of 5.5%, and what's in our central outlook, which I think is somethin g like 4.6% (sic) [4.4%]  peak of the current levels.",2023,4
2,2,John McDonald,Analyst,Autonomous Research,"Okay. And then, just to follow up on the NII, could you give us some sensitivity to that outlook when you flex the amount of Fed cuts? Like
what's the impact of a few Fed cuts and how much does it matter like for the first two versus if you're thinking four, five, six? I know  it's
complicated, but maybe a little bit of color on like how sensitive you are to a couple of cuts might be helpful .",2023,4
3,2,Jeremy Barnum,Chief Financial Officer,JPMorgan Chase & Co.,"Sure. Yeah, happy to do that, John. So, I think probably the best way to do this is to look at our EaR numbers. So, as you kn ow, we don't
update that until the Q. But on an estimated basis, it's going to be a little bit low er. So, I think something like $1.9 billion as opposed to $2.1
billion. So, just round numbers, about $2 billion in EaR. I think, empirically, the number is maybe a little higher than that  just because even
though we do model lags in the EaR, we've been se eing the lag effect be a little bit bigger. But just crudely, I think as I noted, we do remain
asset -sensitive. That's one way to quantify it. I would say the empirical number would maybe be a little higher than that, and hope fully, that
gives you enough t o work with .",2023,4
4,2,John McDonald,Analyst,Autonomous Research,Okay. Thanks .,2023,4
0,3,Jim Mitchell,Analyst,Seapor t Global Securities LLC,"Hey. Good morning. Maybe just to follow up in a different way on the NII question, just in deposits, can you, Jeremy, discuss  your assumptions
on the reprice and migration thoughts? And then, layering in if we do get six cuts, does that start to change the dynamic around growth in
deposits? How are you thinking about all that ?",2023,4
